{
  "schema_version": "1.0",
  "id": "portable_v1",
  "scheduler": {
    "queue": "rolling",
    "admission": "declared_order_first_fit",
    "failure_policy": "fail_fast_no_new_admissions"
  },
  "classes": {
    "bulk_canonical": {
      "description": "Concurrent internal search work with only canonical evaluable outputs.",
      "generate_data": {
        "minimum_cpu_threads": 1,
        "preferred_cpu_threads": 8,
        "minimum_memory_gib": 4,
        "preferred_memory_gib": 32
      },
      "inference": {
        "minimum_cpu_threads": 1,
        "preferred_cpu_threads": 4,
        "minimum_memory_gib": 4,
        "preferred_memory_gib": 16,
        "planner": "auto",
        "planner_time_limit_seconds": 300
      },
      "evaluation": {
        "minimum_cpu_threads": 1,
        "preferred_cpu_threads": 1,
        "minimum_memory_gib": 1,
        "preferred_memory_gib": 4
      },
      "output_profile": "canonical",
      "exclusive_inference": false
    },
    "efficiency_development_canonical": {
      "description": "Serial counterbalanced efficiency-development measurements with canonical outputs and identical per-arm resources.",
      "generate_data": {
        "minimum_cpu_threads": 1,
        "preferred_cpu_threads": 8,
        "minimum_memory_gib": 4,
        "preferred_memory_gib": 32
      },
      "inference": {
        "minimum_cpu_threads": 1,
        "preferred_cpu_threads": 4,
        "minimum_memory_gib": 4,
        "preferred_memory_gib": 16,
        "planner": "auto",
        "planner_time_limit_seconds": 300
      },
      "evaluation": {
        "minimum_cpu_threads": 1,
        "preferred_cpu_threads": 1,
        "minimum_memory_gib": 1,
        "preferred_memory_gib": 4
      },
      "output_profile": "canonical",
      "exclusive_inference": true
    },
    "bulk_full": {
      "description": "Concurrent confirmatory or publication work with complete ANDREA outputs.",
      "generate_data": {
        "minimum_cpu_threads": 1,
        "preferred_cpu_threads": 8,
        "minimum_memory_gib": 4,
        "preferred_memory_gib": 32
      },
      "inference": {
        "minimum_cpu_threads": 1,
        "preferred_cpu_threads": 4,
        "minimum_memory_gib": 4,
        "preferred_memory_gib": 16,
        "planner": "auto",
        "planner_time_limit_seconds": 300
      },
      "evaluation": {
        "minimum_cpu_threads": 1,
        "preferred_cpu_threads": 1,
        "minimum_memory_gib": 1,
        "preferred_memory_gib": 4
      },
      "output_profile": "full",
      "exclusive_inference": false
    },
    "smoke_full": {
      "description": "Minimal end-to-end verification with complete inspectable outputs.",
      "generate_data": {
        "minimum_cpu_threads": 1,
        "preferred_cpu_threads": 2,
        "minimum_memory_gib": 2,
        "preferred_memory_gib": 8
      },
      "inference": {
        "minimum_cpu_threads": 1,
        "preferred_cpu_threads": 2,
        "minimum_memory_gib": 2,
        "preferred_memory_gib": 8,
        "planner": "heuristic",
        "planner_time_limit_seconds": 30
      },
      "evaluation": {
        "minimum_cpu_threads": 1,
        "preferred_cpu_threads": 1,
        "minimum_memory_gib": 1,
        "preferred_memory_gib": 2
      },
      "output_profile": "full",
      "exclusive_inference": false
    },
    "scale_canonical": {
      "description": "Isolated outcome-blind scale scouting with canonical outputs only.",
      "generate_data": {
        "minimum_cpu_threads": 1,
        "preferred_cpu_threads": 8,
        "minimum_memory_gib": 8,
        "preferred_memory_gib": 64
      },
      "inference": {
        "minimum_cpu_threads": 1,
        "preferred_cpu_threads": 8,
        "minimum_memory_gib": 8,
        "preferred_memory_gib": 64,
        "planner": "heuristic",
        "planner_time_limit_seconds": 300
      },
      "evaluation": {
        "minimum_cpu_threads": 1,
        "preferred_cpu_threads": 1,
        "minimum_memory_gib": 2,
        "preferred_memory_gib": 8
      },
      "output_profile": "canonical",
      "exclusive_inference": true
    },
    "scale_full": {
      "description": "Isolated confirmatory dimensional-transfer work with complete outputs.",
      "generate_data": {
        "minimum_cpu_threads": 1,
        "preferred_cpu_threads": 8,
        "minimum_memory_gib": 8,
        "preferred_memory_gib": 64
      },
      "inference": {
        "minimum_cpu_threads": 1,
        "preferred_cpu_threads": 8,
        "minimum_memory_gib": 8,
        "preferred_memory_gib": 64,
        "planner": "heuristic",
        "planner_time_limit_seconds": 300
      },
      "evaluation": {
        "minimum_cpu_threads": 1,
        "preferred_cpu_threads": 1,
        "minimum_memory_gib": 2,
        "preferred_memory_gib": 8
      },
      "output_profile": "full",
      "exclusive_inference": true
    },
    "performance_full": {
      "description": "One-at-a-time formal performance measurements with complete outputs.",
      "generate_data": {
        "minimum_cpu_threads": 1,
        "preferred_cpu_threads": 8,
        "minimum_memory_gib": 8,
        "preferred_memory_gib": 64
      },
      "inference": {
        "minimum_cpu_threads": 1,
        "preferred_cpu_threads": 8,
        "minimum_memory_gib": 8,
        "preferred_memory_gib": 64,
        "planner": "heuristic",
        "planner_time_limit_seconds": 300
      },
      "evaluation": {
        "minimum_cpu_threads": 1,
        "preferred_cpu_threads": 1,
        "minimum_memory_gib": 2,
        "preferred_memory_gib": 8
      },
      "output_profile": "full",
      "exclusive_inference": true
    }
  }
}
